{
 "schema": 1,
 "week": "2026-W44",
 "generated": "2026-10-26",
 "notes": [
  "Gaps are found by comparing words, not meaning: a plugin can solve a request without sharing its vocabulary, so treat \"likelyGap\" as \"worth a look\", not as proof.",
  "Some requests ask for changes to Obsidian itself (core app, mobile apps, Sync, Publish). Those are flagged appLevel and may not be possible as a plugin.",
  "maintainersWanted lists plugins people still download in large numbers whose repository has been quiet for a long time. It is an invitation, not a judgement: authors owe nobody their free time. Fork, offer help or build an alternative, and be kind about it.",
  "Entries with provisional=true have not been checked against GitHub yet (open issues unknown); their score leaves the issues component out."
 ],
 "forum": {
  "state": "ok",
  "fetchedAt": "2026-10-26T11:47:58.944Z",
  "topics": 986,
  "source": "https://forum.obsidian.md"
 },
 "gaps": [
  {
   "id": "gap-15339",
   "title": "Edit transcluded (embedded) notes (blocks) in place (likely requires WYSWYG first)",
   "keywords": [
    "likely",
    "wyswyg",
    "transcluded",
    "requires"
   ],
   "requests": 1,
   "likes": 1079,
   "views": 31975,
   "status": "likely-gap",
   "coverage": 0.268,
   "rank": 501.1,
   "appLevel": true,
   "firstRequested": "2021-03-26",
   "lastActive": "2026-07-18",
   "closestPlugins": [
    {
     "id": "embed-editor",
     "name": "Embed Editor",
     "similarity": 0.268,
     "downloads": 1819,
     "url": "https://obsidian.md/plugins?id=embed-editor"
    },
    {
     "id": "seamless-embeds",
     "name": "Seamless Embeds",
     "similarity": 0.267,
     "downloads": 860,
     "url": "https://obsidian.md/plugins?id=seamless-embeds"
    },
    {
     "id": "embed-code-file",
     "name": "Embed Code File",
     "similarity": 0.187,
     "downloads": 9186,
     "url": "https://obsidian.md/plugins?id=embed-code-file"
    },
    {
     "id": "todoapp",
     "name": "TodoApp Blocks",
     "similarity": 0.185,
     "downloads": 547,
     "url": "https://obsidian.md/plugins?id=todoapp"
    },
    {
     "id": "sync-embeds",
     "name": "Sync Embeds",
     "similarity": 0.176,
     "downloads": 27804,
     "url": "https://obsidian.md/plugins?id=sync-embeds"
    }
   ],
   "evidence": [
    {
     "title": "Edit transcluded (embedded) notes (blocks) in place (likely requires WYSWYG first)",
     "url": "https://forum.obsidian.md/t/edit-transcluded-embedded-notes-blocks-in-place-likely-requires-wyswyg-first/15339",
     "likes": 1079,
     "created": "2021-03-26"
    }
   ]
  },
  {
   "id": "gap-41517",
   "title": "Fully visual editor mode (WYSIWYG / WYSWYG)",
   "keywords": [
    "wyswyg",
    "wysiwyg",
    "fully",
    "visual"
   ],
   "requests": 1,
   "likes": 799,
   "views": 38228,
   "status": "likely-gap",
   "coverage": 0.33,
   "rank": 272,
   "appLevel": true,
   "firstRequested": "2022-08-07",
   "lastActive": "2026-07-14",
   "closestPlugins": [
    {
     "id": "butter-editor",
     "name": "Butter Editor",
     "similarity": 0.33,
     "downloads": 2970,
     "url": "https://obsidian.md/plugins?id=butter-editor"
    },
    {
     "id": "editor-mode-button",
     "name": "Editor Mode Button",
     "similarity": 0.28,
     "downloads": 1261,
     "url": "https://obsidian.md/plugins?id=editor-mode-button"
    },
    {
     "id": "wysimark-editor",
     "name": "Wysimark Editor",
     "similarity": 0.264,
     "downloads": 7832,
     "url": "https://obsidian.md/plugins?id=wysimark-editor"
    },
    {
     "id": "html-visual-editor",
     "name": "HTML Visual Editor",
     "similarity": 0.24,
     "downloads": 762,
     "url": "https://obsidian.md/plugins?id=html-visual-editor"
    },
    {
     "id": "mathlive-in-editor-mode",
     "name": "MathLive in Editor Mode",
     "similarity": 0.23,
     "downloads": 4021,
     "url": "https://obsidian.md/plugins?id=mathlive-in-editor-mode"
    }
   ],
   "evidence": [
    {
     "title": "Fully visual editor mode (WYSIWYG / WYSWYG)",
     "url": "https://forum.obsidian.md/t/fully-visual-editor-mode-wysiwyg-wyswyg/41517",
     "likes": 799,
     "created": "2022-08-07"
    }
   ]
  },
  {
   "id": "gap-64139",
   "title": "Properties: let the user customize the way Dates/Times are displayed (independently from OS)",
   "keywords": [
    "independently",
    "properties",
    "os",
    "customize"
   ],
   "requests": 1,
   "likes": 662,
   "views": 30235,
   "status": "partly-covered",
   "coverage": 0.379,
   "rank": 160.4,
   "appLevel": false,
   "firstRequested": "2023-07-31",
   "lastActive": "2026-09-30",
   "closestPlugins": [
    {
     "id": "yaml-properties",
     "name": "YAML Properties",
     "similarity": 0.379,
     "downloads": 3573,
     "url": "https://obsidian.md/plugins?id=yaml-properties"
    },
    {
     "id": "property-order",
     "name": "Property Order",
     "similarity": 0.304,
     "downloads": 2529,
     "url": "https://obsidian.md/plugins?id=property-order"
    },
    {
     "id": "property-reminders",
     "name": "Property Reminders",
     "similarity": 0.3,
     "downloads": 152,
     "url": "https://obsidian.md/plugins?id=property-reminders"
    },
    {
     "id": "date-linker",
     "name": "Date Linker",
     "similarity": 0.298,
     "downloads": 40,
     "url": "https://obsidian.md/plugins?id=date-linker"
    },
    {
     "id": "property-annotations",
     "name": "Property Annotations",
     "similarity": 0.294,
     "downloads": 143,
     "url": "https://obsidian.md/plugins?id=property-annotations"
    }
   ],
   "evidence": [
    {
     "title": "Properties: let the user customize the way Dates/Times are displayed (independently from OS)",
     "url": "https://forum.obsidian.md/t/properties-let-the-user-customize-the-way-dates-times-are-displayed-independently-from-os/64139",
     "likes": 662,
     "created": "2023-07-31"
    }
   ]
  },
  {
   "id": "gap-20727",
   "title": "Writing in tree structure - The solution to long form writing (Gingko)",
   "keywords": [
    "gingko",
    "writing",
    "solution",
    "form"
   ],
   "requests": 2,
   "likes": 460,
   "views": 32552,
   "status": "likely-gap",
   "coverage": 0.341,
   "rank": 146.9,
   "appLevel": false,
   "firstRequested": "2021-05-23",
   "lastActive": "2026-05-21",
   "closestPlugins": [
    {
     "id": "lineage",
     "name": "Lineage",
     "similarity": 0.366,
     "downloads": 25074,
     "url": "https://obsidian.md/plugins?id=lineage"
    },
    {
     "id": "writing-buddy",
     "name": "Writing Buddy",
     "similarity": 0.325,
     "downloads": 306,
     "url": "https://obsidian.md/plugins?id=writing-buddy"
    },
    {
     "id": "folio",
     "name": "Folio",
     "similarity": 0.289,
     "downloads": 1557,
     "url": "https://obsidian.md/plugins?id=folio"
    },
    {
     "id": "writing",
     "name": "Writing",
     "similarity": 0.283,
     "downloads": 10457,
     "url": "https://obsidian.md/plugins?id=writing"
    },
    {
     "id": "novelr",
     "name": "Novelr",
     "similarity": 0.28,
     "downloads": 343,
     "url": "https://obsidian.md/plugins?id=novelr"
    }
   ],
   "evidence": [
    {
     "title": "Writing in tree structure - The solution to long form writing (Gingko)",
     "url": "https://forum.obsidian.md/t/writing-in-tree-structure-the-solution-to-long-form-writing-gingko/20727",
     "likes": 449,
     "created": "2021-07-12"
    },
    {
     "title": "Gingko Plugin",
     "url": "https://forum.obsidian.md/t/gingko-plugin/18645",
     "likes": 11,
     "created": "2021-05-23"
    }
   ]
  },
  {
   "id": "gap-915",
   "title": "Obsidian Run in Portable Mode?",
   "keywords": [
    "portable",
    "run",
    "mode"
   ],
   "requests": 1,
   "likes": 323,
   "views": 98021,
   "status": "likely-gap",
   "coverage": 0.3,
   "rank": 129.6,
   "appLevel": true,
   "firstRequested": "2020-06-01",
   "lastActive": "2026-02-24",
   "closestPlugins": [
    {
     "id": "power-mode",
     "name": "POWER MODE",
     "similarity": 0.3,
     "downloads": 3521,
     "url": "https://obsidian.md/plugins?id=power-mode"
    },
    {
     "id": "run",
     "name": "Run",
     "similarity": 0.288,
     "downloads": 3887,
     "url": "https://obsidian.md/plugins?id=run"
    },
    {
     "id": "private-mode",
     "name": "Private Mode",
     "similarity": 0.286,
     "downloads": 2031,
     "url": "https://obsidian.md/plugins?id=private-mode"
    },
    {
     "id": "frontmatter-viewmode",
     "name": "Set View Mode per Note",
     "similarity": 0.268,
     "downloads": 3374,
     "url": "https://obsidian.md/plugins?id=frontmatter-viewmode"
    },
    {
     "id": "just-simple-excalidraw",
     "name": "Just Simple Excalidraw",
     "similarity": 0.265,
     "downloads": 2378,
     "url": "https://obsidian.md/plugins?id=just-simple-excalidraw"
    }
   ],
   "evidence": [
    {
     "title": "Obsidian Run in Portable Mode?",
     "url": "https://forum.obsidian.md/t/obsidian-run-in-portable-mode/915",
     "likes": 323,
     "created": "2020-06-01"
    }
   ]
  },
  {
   "id": "gap-2049",
   "title": "Obsidian for web",
   "keywords": [
    "publish",
    "wordpress",
    "web",
    "properties"
   ],
   "requests": 8,
   "likes": 1373,
   "views": 293686,
   "status": "partly-covered",
   "coverage": 0.462,
   "rank": 105,
   "appLevel": true,
   "firstRequested": "2020-06-17",
   "lastActive": "2026-10-25",
   "closestPlugins": [
    {
     "id": "obsidian-wordpress",
     "name": "WordPress",
     "similarity": 0.965,
     "downloads": 20875,
     "url": "https://obsidian.md/plugins?id=obsidian-wordpress"
    },
    {
     "id": "publish-to-wordpress",
     "name": "Publish to WordPress",
     "similarity": 0.783,
     "downloads": 600,
     "url": "https://obsidian.md/plugins?id=publish-to-wordpress"
    },
    {
     "id": "github-publish",
     "name": "GitHub Publish",
     "similarity": 0.571,
     "downloads": 720,